{
    "$schema": "../schemas/domain.json",

    "domain": "is-a-frontend.dev",
    "subdomain": "anish",

    "owner": {
        "email": "anishn0509@gmail.com"
    },

    "records": {
        "CNAME": {
            "value": "anishnarayan1.github.io.",
            "proxied": false
        },

        "TXT": [
            {
                "name": "_github-pages-challenge-AnishNarayan1",
                "value": "48401d78e76c51bfa3b976e72c2b3b"
            }
        ]
    }
}
